{
  "schema_version": "pfn.v1",
  "event_id": "5f0e0000-0000-4000-8000-000000000029",
  "trace_id": "5f0e0000-0000-4000-8000-000000000004",
  "source_node_id": "NODE-RPI5-02",
  "observation_type": "ACTIVITY_CONTEXT",
  "zone": "desk",
  "confidence": 0.84,
  "attributes": {
    "activity": "MEETING",
    "audio_context": "ZOOM_SPEAKER",
    "quiet_required": true,
    "transition": "ACTIVATED",
    "evidence": [
      "AUDIO_CONTEXT:ZOOM_SPEAKER",
      "PRESENCE:DESK"
    ],
    "valid_until_ms": 1792560030000,
    "model_version": "yamnet-temporal-cost-ensemble-v0.8.0-50-50"
  },
  "observed_at_ms": 1792560000000,
  "simulated": true
}
